{"applied":false,"audit_coverage":"not_wired","backup_coverage":"not_wired","basis_verified":true,"batch_id":"p1","canonical_official":false,"current_supported_typed_fact":false,"next_action":"apply_via_vpwiki_admin","publication":"unpublished","ranking":"not_ranked","receipt_backed":false,"request":{"applied":false,"articles_batch":null,"audit_coverage":"not_wired","backup_coverage":"not_wired","basis":{"article_store_inventory_sha256":"aaaaaaaaaaaaaaaaaaaaaaaaaaaaaaaaaaaaaaaaaaaaaaaaaaaaaaaaaaaaaaaa","assessment_heads_sha256":"aaaaaaaaaaaaaaaaaaaaaaaaaaaaaaaaaaaaaaaaaaaaaaaaaaaaaaaaaaaaaaaa","claim_ledger_sha256":"aaaaaaaaaaaaaaaaaaaaaaaaaaaaaaaaaaaaaaaaaaaaaaaaaaaaaaaaaaaaaaaa","domain_store_inventory_sha256":"aaaaaaaaaaaaaaaaaaaaaaaaaaaaaaaaaaaaaaaaaaaaaaaaaaaaaaaaaaaaaaaa","experiment_store_inventory_sha256":"aaaaaaaaaaaaaaaaaaaaaaaaaaaaaaaaaaaaaaaaaaaaaaaaaaaaaaaaaaaaaaaa"},"batch_id":"p1","canonical_official":false,"counts":{"articles":0,"claims":0,"concepts":0,"conditions":0,"lineages":0,"pages":3,"pairwise":0,"papers":0,"versions":0},"current_supported_typed_fact":false,"foreign_paths":["wiki/reading/notes.txt"],"graph_sha256":"aaaaaaaaaaaaaaaaaaaaaaaaaaaaaaaaaaaaaaaaaaaaaaaaaaaaaaaaaaaaaaaa","install_path":"wiki/reading","kind":"reading","manifest_sha256":"aaaaaaaaaaaaaaaaaaaaaaaaaaaaaaaaaaaaaaaaaaaaaaaaaaaaaaaaaaaaaaaa","matrix_sha256":"aaaaaaaaaaaaaaaaaaaaaaaaaaaaaaaaaaaaaaaaaaaaaaaaaaaaaaaaaaaaaaaa","next_action":"inspect_reading_publication","paper_filter":null,"payloads":[{"after_sha256":"aaaaaaaaaaaaaaaaaaaaaaaaaaaaaaaaaaaaaaaaaaaaaaaaaaaaaaaaaaaaaaaa","before_sha256":null,"mode":"create","path":"wiki/reading/concepts.md","size_bytes":32,"staged_path":"reading/concepts.md"},{"after_sha256":"aaaaaaaaaaaaaaaaaaaaaaaaaaaaaaaaaaaaaaaaaaaaaaaaaaaaaaaaaaaaaaaa","before_sha256":"bbbbbbbbbbbbbbbbbbbbbbbbbbbbbbbbbbbbbbbbbbbbbbbbbbbbbbbbbbbbbbbb","mode":"replace","path":"wiki/reading/index.md","size_bytes":64,"staged_path":"reading/index.md"},{"after_sha256":"aaaaaaaaaaaaaaaaaaaaaaaaaaaaaaaaaaaaaaaaaaaaaaaaaaaaaaaaaaaaaaaa","before_sha256":"aaaaaaaaaaaaaaaaaaaaaaaaaaaaaaaaaaaaaaaaaaaaaaaaaaaaaaaaaaaaaaaa","mode":"keep","path":"wiki/reading/legend.md","size_bytes":16,"staged_path":"reading/legend.md"},{"after_sha256":null,"before_sha256":"aaaaaaaaaaaaaaaaaaaaaaaaaaaaaaaaaaaaaaaaaaaaaaaaaaaaaaaaaaaaaaaa","mode":"delete","path":"wiki/reading/manifest.json","size_bytes":null,"staged_path":null}],"publication":"unpublished","ranking":"not_ranked","reading_notes_root":"wiki/reading-notes","receipt_backed":false,"schema":"video-paper-wiki.reading-publication-request.v1","transaction_authority":"not_wired","typed_fact_promotion":"none","vault_written":false,"write_plan_counts":{"create":1,"delete":1,"foreign":1,"keep":1,"replace":1}},"request_sha256":"aaaaaaaaaaaaaaaaaaaaaaaaaaaaaaaaaaaaaaaaaaaaaaaaaaaaaaaaaaaaaaaa","schema":"video-paper-wiki.reading-publication-inspection.v1","staged_verified":true,"targets_verified":true,"transaction_authority":"not_wired","typed_fact_promotion":"none","vault_written":false}
